{
  "app": "izumi",
  "kind": "theme-catalog",
  "schemaVersion": 1,
  "themes": [
    {
      "id": "izumi.blossom",
      "name": "Blossom",
      "version": "2.0.2",
      "author": "Izumi",
      "description": "Dantotsu look: pure black and pink, a profile banner with hub cards, ★ cover rails, bottom series tabs.",
      "themeApi": 5,
      "tags": [
        "Phone",
        "Dark",
        "App",
        "Pink"
      ],
      "platforms": [
        "phone",
        "desktop"
      ],
      "project": "https://github.com/nickEatsBread/izumi-themes",
      "download": "https://raw.githubusercontent.com/nickEatsBread/izumi-themes/main/packages/izumi.blossom/2.0.2.json",
      "sha256": "c3c2e35dfe6e8ce342310d6929c9d9ff04a99e594004c715e90e14e25f8f0fc7",
      "bytes": 125155,
      "preview": "https://raw.githubusercontent.com/nickEatsBread/izumi-themes/main/previews/izumi.blossom.png"
    },
    {
      "id": "izumi.booth",
      "name": "Booth",
      "version": "2.0.2",
      "author": "Izumi",
      "description": "Miruro look: near-black and lavender in Geist, a card hero with a gradient title, a tabbed grid and a Top Airing aside.",
      "themeApi": 5,
      "tags": [
        "Dark",
        "Site",
        "Top bar",
        "Docked player"
      ],
      "platforms": [
        "desktop",
        "phone"
      ],
      "project": "https://github.com/nickEatsBread/izumi-themes",
      "download": "https://raw.githubusercontent.com/nickEatsBread/izumi-themes/main/packages/izumi.booth/2.0.2.json",
      "sha256": "5b29d1f23cfc2ba0820f36b8cc1d04f689b69e1174c222e766775bc26c988d72",
      "bytes": 73698,
      "preview": "https://raw.githubusercontent.com/nickEatsBread/izumi-themes/main/previews/izumi.booth.png"
    },
    {
      "id": "izumi.carbon",
      "name": "Carbon",
      "version": "1.0.4",
      "author": "Izumi",
      "description": "Anime Nexus look: zinc in DM Sans, a centred logo, a light Watch now, corner-badged episodes, a popular list.",
      "themeApi": 5,
      "tags": [
        "Dark",
        "Site",
        "Top bar",
        "Docked player"
      ],
      "platforms": [
        "desktop",
        "phone"
      ],
      "project": "https://github.com/nickEatsBread/izumi-themes",
      "download": "https://raw.githubusercontent.com/nickEatsBread/izumi-themes/main/packages/izumi.carbon/1.0.4.json",
      "sha256": "14cf6618af87c68e1fe233f056f793e26c87adb8a725c4430e4f0a947ea2d4b8",
      "bytes": 59454,
      "preview": "https://raw.githubusercontent.com/nickEatsBread/izumi-themes/main/previews/izumi.carbon.png"
    },
    {
      "id": "izumi.cobalt",
      "name": "Cobalt",
      "version": "1.0.1",
      "author": "Izumi",
      "description": "A tracker-style navy canvas with a sky-blue accent and square corners. The stock featured banner keeps its rank badge, poster rows carry grey captions, and the series page stacks a muted facts panel — format, episodes, season, studio, source — beside the cover, with episodes in a still grid.",
      "themeApi": 2,
      "tags": [
        "Dark",
        "Tracker",
        "Facts panel"
      ],
      "platforms": [
        "desktop",
        "phone"
      ],
      "project": "https://github.com/nickEatsBread/izumi-themes",
      "download": "https://raw.githubusercontent.com/nickEatsBread/izumi-themes/main/packages/izumi.cobalt/1.0.1.json",
      "sha256": "b87625113345c26ffe975f31f539c8d97a9837e5f13ecbb0eb340fc578ee1930",
      "bytes": 16576,
      "preview": "https://raw.githubusercontent.com/nickEatsBread/izumi-themes/main/previews/izumi.cobalt.png"
    },
    {
      "id": "izumi.coral",
      "name": "Coral",
      "version": "2.0.3",
      "author": "Izumi",
      "description": "Zangetsu look: near-black and coral, a glowing card hero, ★ poster rails, a floating dock, full-bleed series header.",
      "themeApi": 5,
      "tags": [
        "Phone",
        "Dark",
        "App",
        "Floating dock"
      ],
      "platforms": [
        "phone",
        "desktop"
      ],
      "project": "https://github.com/nickEatsBread/izumi-themes",
      "download": "https://raw.githubusercontent.com/nickEatsBread/izumi-themes/main/packages/izumi.coral/2.0.3.json",
      "sha256": "1d5c8c5759b3812d8b5b7ffbc42cef01ebf6052e411e5f0837b7e96d6da9820f",
      "bytes": 150805,
      "preview": "https://raw.githubusercontent.com/nickEatsBread/izumi-themes/main/previews/izumi.coral.png"
    },
    {
      "id": "izumi.daylight",
      "name": "Daylight",
      "version": "1.0.0",
      "author": "Izumi",
      "description": "The catalog’s light theme. A warm paper canvas, serif type and a coral accent. Top navigation, a featured backdrop with a paper caption card and an ink-dark Watch button, generously rounded poster rows with titles and years, and a split series page with a right-hand episode rail.",
      "themeApi": 2,
      "tags": [
        "Light",
        "Serif",
        "Top nav"
      ],
      "platforms": [
        "desktop",
        "phone"
      ],
      "project": "https://github.com/nickEatsBread/izumi-themes",
      "download": "https://raw.githubusercontent.com/nickEatsBread/izumi-themes/main/packages/izumi.daylight/1.0.0.json",
      "sha256": "9a42aba2ea34add0a79adda2e4492614f4ef6a69d485bd7fb7fc3e04a8812f4d",
      "bytes": 12350,
      "preview": "https://raw.githubusercontent.com/nickEatsBread/izumi-themes/main/previews/izumi.daylight.png"
    },
    {
      "id": "izumi.ember",
      "name": "Ember",
      "version": "1.2.1",
      "author": "Izumi",
      "description": "A warm crimson living-room palette: tinted cards, a red accent, landscape resume art and the same split episode rail as Tidal.",
      "themeApi": 1,
      "tags": [
        "Dark",
        "Overlay",
        "Landscape"
      ],
      "project": "https://github.com/nickEatsBread/izumi-themes",
      "download": "https://raw.githubusercontent.com/nickEatsBread/izumi-themes/main/packages/izumi.ember/1.2.1.json",
      "sha256": "13979860abc447f5f27d7935eed8078dd33f11dc9b31a3d72058b7134a0a2613",
      "bytes": 10060,
      "preview": "https://raw.githubusercontent.com/nickEatsBread/izumi-themes/main/previews/izumi.ember.png"
    },
    {
      "id": "izumi.frost",
      "name": "Frost",
      "version": "2.0.2",
      "author": "Izumi",
      "description": "MKissa look: pure black in Inter, a labelled side rail, big poster cards with episode footers, orange ranks.",
      "themeApi": 5,
      "tags": [
        "Dark",
        "Site",
        "Side rail",
        "Docked player"
      ],
      "platforms": [
        "desktop",
        "phone"
      ],
      "project": "https://github.com/nickEatsBread/izumi-themes",
      "download": "https://raw.githubusercontent.com/nickEatsBread/izumi-themes/main/packages/izumi.frost/2.0.2.json",
      "sha256": "cff557a22de9ec77af676951267dbd63dd03d17b74a65aae6eed5d47bf9e6bc6",
      "bytes": 56356,
      "preview": "https://raw.githubusercontent.com/nickEatsBread/izumi-themes/main/previews/izumi.frost.png"
    },
    {
      "id": "izumi.halo",
      "name": "Halo",
      "version": "1.2.1",
      "author": "Izumi",
      "description": "Frosted chrome: a top navigation bar, aurora glass, large landscape tiles and quiet poster titles. The seekbar uses the brand accent.",
      "themeApi": 1,
      "tags": [
        "Dark",
        "Glass",
        "Top nav"
      ],
      "project": "https://github.com/nickEatsBread/izumi-themes",
      "download": "https://raw.githubusercontent.com/nickEatsBread/izumi-themes/main/packages/izumi.halo/1.2.1.json",
      "sha256": "6eae249d8b07c990a5101e3f894fedfd85ce4249f3f33ee3b496fd75e34a868a",
      "bytes": 9063,
      "preview": "https://raw.githubusercontent.com/nickEatsBread/izumi-themes/main/previews/izumi.halo.png"
    },
    {
      "id": "izumi.iris",
      "name": "Iris",
      "version": "1.0.3",
      "author": "Izumi",
      "description": "Senshi look: near-black and purple, a full-bleed hero under a clear header, overlay poster rails, medal-ranked trending.",
      "themeApi": 5,
      "tags": [
        "Dark",
        "Site",
        "Top bar",
        "Docked player"
      ],
      "platforms": [
        "desktop",
        "phone"
      ],
      "project": "https://github.com/nickEatsBread/izumi-themes",
      "download": "https://raw.githubusercontent.com/nickEatsBread/izumi-themes/main/packages/izumi.iris/1.0.3.json",
      "sha256": "bc9765579fb28b802077625b376f4ef8a811f2e3eddb81c56bab0d642622d685",
      "bytes": 75151,
      "preview": "https://raw.githubusercontent.com/nickEatsBread/izumi-themes/main/previews/izumi.iris.png"
    },
    {
      "id": "izumi.kindling",
      "name": "Kindling",
      "version": "1.5.0",
      "author": "Izumi",
      "description": "Cool gray canvas, rose accent, Nunito. Home opens on a rotating full-bleed featured banner with Watch Now and View Details, then horizontal poster rows. The series page uses icon facts, an overlapping cover, and a right-hand rail with one short episode tile per row — square still on the left, title and synopsis on the right, grow-on-hover. Phones get a shorter banner, tighter rows and a stacked series page with the same episode tiles.",
      "themeApi": 2,
      "tags": [
        "Dark",
        "Split series",
        "Episode rail"
      ],
      "platforms": [
        "desktop",
        "phone"
      ],
      "project": "https://github.com/nickEatsBread/izumi-themes",
      "download": "https://raw.githubusercontent.com/nickEatsBread/izumi-themes/main/packages/izumi.kindling/1.5.0.json",
      "sha256": "cf4e797515aeadeb69bf2d1c556ad69491d9771ff75a3c95ceade30544948cf5",
      "bytes": 25961,
      "preview": "https://raw.githubusercontent.com/nickEatsBread/izumi-themes/main/previews/izumi.kindling.png"
    },
    {
      "id": "izumi.lavender",
      "name": "Lavender",
      "version": "2.0.3",
      "author": "Izumi",